{
  "schema_version": 1,
  "run_id": "20261011-120000-abcdef",
  "checked_at": "2026-10-11T10:05:00.000Z",
  "normalisation": "whitespace, quotes, case",
  "results": [
    {
      "finding_id": "F-GAP-002-01",
      "gap_id": "GAP-002",
      "source_id": "SRC-aaaa0001",
      "passed": true,
      "reasons": [],
      "detail": ""
    },
    {
      "finding_id": "F-GAP-002-02",
      "gap_id": "GAP-002",
      "source_id": "SRC-aaaa0001",
      "passed": true,
      "reasons": [],
      "detail": ""
    },
    {
      "finding_id": "F-GAP-002-03",
      "gap_id": "GAP-002",
      "source_id": "SRC-bbbb0002",
      "passed": true,
      "reasons": [],
      "detail": ""
    },
    {
      "finding_id": "F-GAP-002-04",
      "gap_id": "GAP-002",
      "source_id": "SRC-aaaa0001",
      "passed": true,
      "reasons": [],
      "detail": ""
    },
    {
      "finding_id": "F-GAP-002-05",
      "gap_id": "GAP-002",
      "source_id": "SRC-aaaa0001",
      "passed": false,
      "reasons": [
        "snippet_not_found"
      ],
      "detail": ""
    }
  ],
  "summary": {
    "checked": 5,
    "passed": 4,
    "failed": 1
  }
}