{
  "schema_version": 1,
  "run_id": "20261011-120000-abcdef",
  "checked_at": "2026-10-11T10:05:00.000Z",
  "normalisation": "whitespace, quotes, case",
  "results": [
    {
      "finding_id": "F-GAP-002-01",
      "gap_id": "GAP-002",
      "source_id": "SRC-cccc0003",
      "passed": true,
      "reasons": [],
      "detail": ""
    },
    {
      "finding_id": "F-GAP-002-02",
      "gap_id": "GAP-002",
      "source_id": "SRC-cccc0003",
      "passed": true,
      "reasons": [],
      "detail": ""
    }
  ],
  "summary": {
    "checked": 2,
    "passed": 2,
    "failed": 0
  }
}